t 0 /NodeList/2/$ns3::Ipv4L3Protocol/Tx(1) ns3::Ipv4Header (tos 0x0 DSCP Default ECN Not-ECT ttl 64 id 0 protocol 6 offset (bytes) 0 flags [none] length: 56 10.1.1.1 > 10.2.2.1) ns3::TcpHeader (49153 > 300 [SYN] Seq=0 Ack=0 Win=65535 ns3::TcpOptionTS(0;0) ns3::TcpOptionWinScale(2) ns3::TcpOptionSackPermitted([sack_perm]) ns3::TcpOptionEnd(EOL))
t 0 /NodeList/3/$ns3::Ipv4L3Protocol/Tx(1) ns3::Ipv4Header (tos 0x0 DSCP Default ECN Not-ECT ttl 64 id 0 protocol 6 offset (bytes) 0 flags [none] length: 56 10.1.2.1 > 10.2.3.1) ns3::TcpHeader (49153 > 300 [SYN] Seq=0 Ack=0 Win=65535 ns3::TcpOptionTS(0;0) ns3::TcpOptionWinScale(2) ns3::TcpOptionSackPermitted([sack_perm]) ns3::TcpOptionEnd(EOL))
r 0.10464 /NodeList/0/$ns3::Ipv4L3Protocol/Rx(2) ns3::Ipv4Header (tos 0x0 DSCP Default ECN Not-ECT ttl 64 id 0 protocol 6 offset (bytes) 0 flags [none] length: 56 10.1.1.1 > 10.2.2.1) ns3::TcpHeader (49153 > 300 [SYN] Seq=0 Ack=0 Win=65535 ns3::TcpOptionTS(0;0) ns3::TcpOptionWinScale(2) ns3::TcpOptionSackPermitted([sack_perm]) ns3::TcpOptionEnd(EOL))
t 0.10464 /NodeList/0/$ns3::Ipv4L3Protocol/Tx(1) ns3::Ipv4Header (tos 0x0 DSCP Default ECN Not-ECT ttl 63 id 0 protocol 6 offset (bytes) 0 flags [none] length: 56 10.1.1.1 > 10.2.2.1) ns3::TcpHeader (49153 > 300 [SYN] Seq=0 Ack=0 Win=65535 ns3::TcpOptionTS(0;0) ns3::TcpOptionWinScale(2) ns3::TcpOptionSackPermitted([sack_perm]) ns3::TcpOptionEnd(EOL))
r 0.10464 /NodeList/0/$ns3::Ipv4L3Protocol/Rx(3) ns3::Ipv4Header (tos 0x0 DSCP Default ECN Not-ECT ttl 64 id 0 protocol 6 offset (bytes) 0 flags [none] length: 56 10.1.2.1 > 10.2.3.1) ns3::TcpHeader (49153 > 300 [SYN] Seq=0 Ack=0 Win=65535 ns3::TcpOptionTS(0;0) ns3::TcpOptionWinScale(2) ns3::TcpOptionSackPermitted([sack_perm]) ns3::TcpOptionEnd(EOL))
t 0.10464 /NodeList/0/$ns3::Ipv4L3Protocol/Tx(1) ns3::Ipv4Header (tos 0x0 DSCP Default ECN Not-ECT ttl 63 id 0 protocol 6 offset (bytes) 0 flags [none] length: 56 10.1.2.1 > 10.2.3.1) ns3::TcpHeader (49153 > 300 [SYN] Seq=0 Ack=0 Win=65535 ns3::TcpOptionTS(0;0) ns3::TcpOptionWinScale(2) ns3::TcpOptionSackPermitted([sack_perm]) ns3::TcpOptionEnd(EOL))
r 0.20928 /NodeList/1/$ns3::Ipv4L3Protocol/Rx(1) ns3::Ipv4Header (tos 0x0 DSCP Default ECN Not-ECT ttl 63 id 0 protocol 6 offset (bytes) 0 flags [none] length: 56 10.1.1.1 > 10.2.2.1) ns3::TcpHeader (49153 > 300 [SYN] Seq=0 Ack=0 Win=65535 ns3::TcpOptionTS(0;0) ns3::TcpOptionWinScale(2) ns3::TcpOptionSackPermitted([sack_perm]) ns3::TcpOptionEnd(EOL))
t 0.20928 /NodeList/1/$ns3::Ipv4L3Protocol/Tx(3) ns3::Ipv4Header (tos 0x0 DSCP Default ECN Not-ECT ttl 62 id 0 protocol 6 offset (bytes) 0 flags [none] length: 56 10.1.1.1 > 10.2.2.1) ns3::TcpHeader (49153 > 300 [SYN] Seq=0 Ack=0 Win=65535 ns3::TcpOptionTS(0;0) ns3::TcpOptionWinScale(2) ns3::TcpOptionSackPermitted([sack_perm]) ns3::TcpOptionEnd(EOL))
r 0.21392 /NodeList/1/$ns3::Ipv4L3Protocol/Rx(1) ns3::Ipv4Header (tos 0x0 DSCP Default ECN Not-ECT ttl 63 id 0 protocol 6 offset (bytes) 0 flags [none] length: 56 10.1.2.1 > 10.2.3.1) ns3::TcpHeader (49153 > 300 [SYN] Seq=0 Ack=0 Win=65535 ns3::TcpOptionTS(0;0) ns3::TcpOptionWinScale(2) ns3::TcpOptionSackPermitted([sack_perm]) ns3::TcpOptionEnd(EOL))
t 0.21392 /NodeList/1/$ns3::Ipv4L3Protocol/Tx(4) ns3::Ipv4Header (tos 0x0 DSCP Default ECN Not-ECT ttl 62 id 0 protocol 6 offset (bytes) 0 flags [none] length: 56 10.1.2.1 > 10.2.3.1) ns3::TcpHeader (49153 > 300 [SYN] Seq=0 Ack=0 Win=65535 ns3::TcpOptionTS(0;0) ns3::TcpOptionWinScale(2) ns3::TcpOptionSackPermitted([sack_perm]) ns3::TcpOptionEnd(EOL))
r 0.31392 /NodeList/6/$ns3::Ipv4L3Protocol/Rx(1) ns3::Ipv4Header (tos 0x0 DSCP Default ECN Not-ECT ttl 62 id 0 protocol 6 offset (bytes) 0 flags [none] length: 56 10.1.1.1 > 10.2.2.1) ns3::TcpHeader (49153 > 300 [SYN] Seq=0 Ack=0 Win=65535 ns3::TcpOptionTS(0;0) ns3::TcpOptionWinScale(2) ns3::TcpOptionSackPermitted([sack_perm]) ns3::TcpOptionEnd(EOL))
t 0.31392 /NodeList/6/$ns3::Ipv4L3Protocol/Tx(1) ns3::Ipv4Header (tos 0x0 DSCP Default ECN Not-ECT ttl 64 id 0 protocol 6 offset (bytes) 0 flags [none] length: 56 10.2.2.1 > 10.1.1.1) ns3::TcpHeader (300 > 49153 [SYN|ACK] Seq=0 Ack=1 Win=65535 ns3::TcpOptionTS(313;0) ns3::TcpOptionWinScale(2) ns3::TcpOptionSackPermitted([sack_perm]) ns3::TcpOptionEnd(EOL))
r 0.31856 /NodeList/7/$ns3::Ipv4L3Protocol/Rx(1) ns3::Ipv4Header (tos 0x0 DSCP Default ECN Not-ECT ttl 62 id 0 protocol 6 offset (bytes) 0 flags [none] length: 56 10.1.2.1 > 10.2.3.1) ns3::TcpHeader (49153 > 300 [SYN] Seq=0 Ack=0 Win=65535 ns3::TcpOptionTS(0;0) ns3::TcpOptionWinScale(2) ns3::TcpOptionSackPermitted([sack_perm]) ns3::TcpOptionEnd(EOL))
t 0.31856 /NodeList/7/$ns3::Ipv4L3Protocol/Tx(1) ns3::Ipv4Header (tos 0x0 DSCP Default ECN Not-ECT ttl 64 id 0 protocol 6 offset (bytes) 0 flags [none] length: 56 10.2.3.1 > 10.1.2.1) ns3::TcpHeader (300 > 49153 [SYN|ACK] Seq=0 Ack=1 Win=65535 ns3::TcpOptionTS(318;0) ns3::TcpOptionWinScale(2) ns3::TcpOptionSackPermitted([sack_perm]) ns3::TcpOptionEnd(EOL))
r 0.41856 /NodeList/1/$ns3::Ipv4L3Protocol/Rx(3) ns3::Ipv4Header (tos 0x0 DSCP Default ECN Not-ECT ttl 64 id 0 protocol 6 offset (bytes) 0 flags [none] length: 56 10.2.2.1 > 10.1.1.1) ns3::TcpHeader (300 > 49153 [SYN|ACK] Seq=0 Ack=1 Win=65535 ns3::TcpOptionTS(313;0) ns3::TcpOptionWinScale(2) ns3::TcpOptionSackPermitted([sack_perm]) ns3::TcpOptionEnd(EOL))
t 0.41856 /NodeList/1/$ns3::Ipv4L3Protocol/Tx(1) ns3::Ipv4Header (tos 0x0 DSCP Default ECN Not-ECT ttl 63 id 0 protocol 6 offset (bytes) 0 flags [none] length: 56 10.2.2.1 > 10.1.1.1) ns3::TcpHeader (300 > 49153 [SYN|ACK] Seq=0 Ack=1 Win=65535 ns3::TcpOptionTS(313;0) ns3::TcpOptionWinScale(2) ns3::TcpOptionSackPermitted([sack_perm]) ns3::TcpOptionEnd(EOL))
r 0.4232 /NodeList/1/$ns3::Ipv4L3Protocol/Rx(4) ns3::Ipv4Header (tos 0x0 DSCP Default ECN Not-ECT ttl 64 id 0 protocol 6 offset (bytes) 0 flags [none] length: 56 10.2.3.1 > 10.1.2.1) ns3::TcpHeader (300 > 49153 [SYN|ACK] Seq=0 Ack=1 Win=65535 ns3::TcpOptionTS(318;0) ns3::TcpOptionWinScale(2) ns3::TcpOptionSackPermitted([sack_perm]) ns3::TcpOptionEnd(EOL))
t 0.4232 /NodeList/1/$ns3::Ipv4L3Protocol/Tx(1) ns3::Ipv4Header (tos 0x0 DSCP Default ECN Not-ECT ttl 63 id 0 protocol 6 offset (bytes) 0 flags [none] length: 56 10.2.3.1 > 10.1.2.1) ns3::TcpHeader (300 > 49153 [SYN|ACK] Seq=0 Ack=1 Win=65535 ns3::TcpOptionTS(318;0) ns3::TcpOptionWinScale(2) ns3::TcpOptionSackPermitted([sack_perm]) ns3::TcpOptionEnd(EOL))
r 0.5232 /NodeList/0/$ns3::Ipv4L3Protocol/Rx(1) ns3::Ipv4Header (tos 0x0 DSCP Default ECN Not-ECT ttl 63 id 0 protocol 6 offset (bytes) 0 flags [none] length: 56 10.2.2.1 > 10.1.1.1) ns3::TcpHeader (300 > 49153 [SYN|ACK] Seq=0 Ack=1 Win=65535 ns3::TcpOptionTS(313;0) ns3::TcpOptionWinScale(2) ns3::TcpOptionSackPermitted([sack_perm]) ns3::TcpOptionEnd(EOL))
t 0.5232 /NodeList/0/$ns3::Ipv4L3Protocol/Tx(2) ns3::Ipv4Header (tos 0x0 DSCP Default ECN Not-ECT ttl 62 id 0 protocol 6 offset (bytes) 0 flags [none] length: 56 10.2.2.1 > 10.1.1.1) ns3::TcpHeader (300 > 49153 [SYN|ACK] Seq=0 Ack=1 Win=65535 ns3::TcpOptionTS(313;0) ns3::TcpOptionWinScale(2) ns3::TcpOptionSackPermitted([sack_perm]) ns3::TcpOptionEnd(EOL))
r 0.52784 /NodeList/0/$ns3::Ipv4L3Protocol/Rx(1) ns3::Ipv4Header (tos 0x0 DSCP Default ECN Not-ECT ttl 63 id 0 protocol 6 offset (bytes) 0 flags [none] length: 56 10.2.3.1 > 10.1.2.1) ns3::TcpHeader (300 > 49153 [SYN|ACK] Seq=0 Ack=1 Win=65535 ns3::TcpOptionTS(318;0) ns3::TcpOptionWinScale(2) ns3::TcpOptionSackPermitted([sack_perm]) ns3::TcpOptionEnd(EOL))
t 0.52784 /NodeList/0/$ns3::Ipv4L3Protocol/Tx(3) ns3::Ipv4Header (tos 0x0 DSCP Default ECN Not-ECT ttl 62 id 0 protocol 6 offset (bytes) 0 flags [none] length: 56 10.2.3.1 > 10.1.2.1) ns3::TcpHeader (300 > 49153 [SYN|ACK] Seq=0 Ack=1 Win=65535 ns3::TcpOptionTS(318;0) ns3::TcpOptionWinScale(2) ns3::TcpOptionSackPermitted([sack_perm]) ns3::TcpOptionEnd(EOL))
r 0.62784 /NodeList/2/$ns3::Ipv4L3Protocol/Rx(1) ns3::Ipv4Header (tos 0x0 DSCP Default ECN Not-ECT ttl 62 id 0 protocol 6 offset (bytes) 0 flags [none] length: 56 10.2.2.1 > 10.1.1.1) ns3::TcpHeader (300 > 49153 [SYN|ACK] Seq=0 Ack=1 Win=65535 ns3::TcpOptionTS(313;0) ns3::TcpOptionWinScale(2) ns3::TcpOptionSackPermitted([sack_perm]) ns3::TcpOptionEnd(EOL))
t 0.62784 /NodeList/2/$ns3::Ipv4L3Protocol/Tx(1) ns3::Ipv4Header (tos 0x0 DSCP Default ECN Not-ECT ttl 64 id 1 protocol 6 offset (bytes) 0 flags [none] length: 52 10.1.1.1 > 10.2.2.1) ns3::TcpHeader (49153 > 300 [ACK] Seq=1 Ack=1 Win=32768 ns3::TcpOptionTS(627;313) ns3::TcpOptionEnd(EOL))
t 0.62784 /NodeList/2/$ns3::Ipv4L3Protocol/Tx(1) ns3::Ipv4Header (tos 0x0 DSCP Default ECN Not-ECT ttl 64 id 2 protocol 6 offset (bytes) 0 flags [none] length: 588 10.1.1.1 > 10.2.2.1) ns3::TcpHeader (49153 > 300 [ACK] Seq=1 Ack=1 Win=32768 ns3::TcpOptionTS(627;313) ns3::TcpOptionEnd(EOL)) Payload (size=512) Payload Fragment [0:24]
r 0.63248 /NodeList/3/$ns3::Ipv4L3Protocol/Rx(1) ns3::Ipv4Header (tos 0x0 DSCP Default ECN Not-ECT ttl 62 id 0 protocol 6 offset (bytes) 0 flags [none] length: 56 10.2.3.1 > 10.1.2.1) ns3::TcpHeader (300 > 49153 [SYN|ACK] Seq=0 Ack=1 Win=65535 ns3::TcpOptionTS(318;0) ns3::TcpOptionWinScale(2) ns3::TcpOptionSackPermitted([sack_perm]) ns3::TcpOptionEnd(EOL))
t 0.63248 /NodeList/3/$ns3::Ipv4L3Protocol/Tx(1) ns3::Ipv4Header (tos 0x0 DSCP Default ECN Not-ECT ttl 64 id 1 protocol 6 offset (bytes) 0 flags [none] length: 52 10.1.2.1 > 10.2.3.1) ns3::TcpHeader (49153 > 300 [ACK] Seq=1 Ack=1 Win=32768 ns3::TcpOptionTS(632;318) ns3::TcpOptionEnd(EOL))
t 0.63248 /NodeList/3/$ns3::Ipv4L3Protocol/Tx(1) ns3::Ipv4Header (tos 0x0 DSCP Default ECN Not-ECT ttl 64 id 2 protocol 6 offset (bytes) 0 flags [none] length: 588 10.1.2.1 > 10.2.3.1) ns3::TcpHeader (49153 > 300 [ACK] Seq=1 Ack=1 Win=32768 ns3::TcpOptionTS(632;318) ns3::TcpOptionEnd(EOL)) Payload (size=512) Payload Fragment [0:24]
r 0.73216 /NodeList/0/$ns3::Ipv4L3Protocol/Rx(2) ns3::Ipv4Header (tos 0x0 DSCP Default ECN Not-ECT ttl 64 id 1 protocol 6 offset (bytes) 0 flags [none] length: 52 10.1.1.1 > 10.2.2.1) ns3::TcpHeader (49153 > 300 [ACK] Seq=1 Ack=1 Win=32768 ns3::TcpOptionTS(627;313) ns3::TcpOptionEnd(EOL))
t 0.73216 /NodeList/0/$ns3::Ipv4L3Protocol/Tx(1) ns3::Ipv4Header (tos 0x0 DSCP Default ECN Not-ECT ttl 63 id 1 protocol 6 offset (bytes) 0 flags [none] length: 52 10.1.1.1 > 10.2.2.1) ns3::TcpHeader (49153 > 300 [ACK] Seq=1 Ack=1 Win=32768 ns3::TcpOptionTS(627;313) ns3::TcpOptionEnd(EOL))
r 0.7368 /NodeList/0/$ns3::Ipv4L3Protocol/Rx(3) ns3::Ipv4Header (tos 0x0 DSCP Default ECN Not-ECT ttl 64 id 1 protocol 6 offset (bytes) 0 flags [none] length: 52 10.1.2.1 > 10.2.3.1) ns3::TcpHeader (49153 > 300 [ACK] Seq=1 Ack=1 Win=32768 ns3::TcpOptionTS(632;318) ns3::TcpOptionEnd(EOL))
t 0.7368 /NodeList/0/$ns3::Ipv4L3Protocol/Tx(1) ns3::Ipv4Header (tos 0x0 DSCP Default ECN Not-ECT ttl 63 id 1 protocol 6 offset (bytes) 0 flags [none] length: 52 10.1.2.1 > 10.2.3.1) ns3::TcpHeader (49153 > 300 [ACK] Seq=1 Ack=1 Win=32768 ns3::TcpOptionTS(632;318) ns3::TcpOptionEnd(EOL))
r 0.77936 /NodeList/0/$ns3::Ipv4L3Protocol/Rx(2) ns3::Ipv4Header (tos 0x0 DSCP Default ECN Not-ECT ttl 64 id 2 protocol 6 offset (bytes) 0 flags [none] length: 588 10.1.1.1 > 10.2.2.1) ns3::TcpHeader (49153 > 300 [ACK] Seq=1 Ack=1 Win=32768 ns3::TcpOptionTS(627;313) ns3::TcpOptionEnd(EOL)) Payload (size=512) Payload Fragment [0:24]
t 0.77936 /NodeList/0/$ns3::Ipv4L3Protocol/Tx(1) ns3::Ipv4Header (tos 0x0 DSCP Default ECN Not-ECT ttl 63 id 2 protocol 6 offset (bytes) 0 flags [none] length: 588 10.1.1.1 > 10.2.2.1) ns3::TcpHeader (49153 > 300 [ACK] Seq=1 Ack=1 Win=32768 ns3::TcpOptionTS(627;313) ns3::TcpOptionEnd(EOL)) Payload (size=512) Payload Fragment [0:24]
r 0.784 /NodeList/0/$ns3::Ipv4L3Protocol/Rx(3) ns3::Ipv4Header (tos 0x0 DSCP Default ECN Not-ECT ttl 64 id 2 protocol 6 offset (bytes) 0 flags [none] length: 588 10.1.2.1 > 10.2.3.1) ns3::TcpHeader (49153 > 300 [ACK] Seq=1 Ack=1 Win=32768 ns3::TcpOptionTS(632;318) ns3::TcpOptionEnd(EOL)) Payload (size=512) Payload Fragment [0:24]
t 0.784 /NodeList/0/$ns3::Ipv4L3Protocol/Tx(1) ns3::Ipv4Header (tos 0x0 DSCP Default ECN Not-ECT ttl 63 id 2 protocol 6 offset (bytes) 0 flags [none] length: 588 10.1.2.1 > 10.2.3.1) ns3::TcpHeader (49153 > 300 [ACK] Seq=1 Ack=1 Win=32768 ns3::TcpOptionTS(632;318) ns3::TcpOptionEnd(EOL)) Payload (size=512) Payload Fragment [0:24]
r 0.83648 /NodeList/1/$ns3::Ipv4L3Protocol/Rx(1) ns3::Ipv4Header (tos 0x0 DSCP Default ECN Not-ECT ttl 63 id 1 protocol 6 offset (bytes) 0 flags [none] length: 52 10.1.1.1 > 10.2.2.1) ns3::TcpHeader (49153 > 300 [ACK] Seq=1 Ack=1 Win=32768 ns3::TcpOptionTS(627;313) ns3::TcpOptionEnd(EOL))
t 0.83648 /NodeList/1/$ns3::Ipv4L3Protocol/Tx(3) ns3::Ipv4Header (tos 0x0 DSCP Default ECN Not-ECT ttl 62 id 1 protocol 6 offset (bytes) 0 flags [none] length: 52 10.1.1.1 > 10.2.2.1) ns3::TcpHeader (49153 > 300 [ACK] Seq=1 Ack=1 Win=32768 ns3::TcpOptionTS(627;313) ns3::TcpOptionEnd(EOL))
r 0.84112 /NodeList/1/$ns3::Ipv4L3Protocol/Rx(1) ns3::Ipv4Header (tos 0x0 DSCP Default ECN Not-ECT ttl 63 id 1 protocol 6 offset (bytes) 0 flags [none] length: 52 10.1.2.1 > 10.2.3.1) ns3::TcpHeader (49153 > 300 [ACK] Seq=1 Ack=1 Win=32768 ns3::TcpOptionTS(632;318) ns3::TcpOptionEnd(EOL))
t 0.84112 /NodeList/1/$ns3::Ipv4L3Protocol/Tx(4) ns3::Ipv4Header (tos 0x0 DSCP Default ECN Not-ECT ttl 62 id 1 protocol 6 offset (bytes) 0 flags [none] length: 52 10.1.2.1 > 10.2.3.1) ns3::TcpHeader (49153 > 300 [ACK] Seq=1 Ack=1 Win=32768 ns3::TcpOptionTS(632;318) ns3::TcpOptionEnd(EOL))
r 0.92656 /NodeList/1/$ns3::Ipv4L3Protocol/Rx(1) ns3::Ipv4Header (tos 0x0 DSCP Default ECN Not-ECT ttl 63 id 2 protocol 6 offset (bytes) 0 flags [none] length: 588 10.1.1.1 > 10.2.2.1) ns3::TcpHeader (49153 > 300 [ACK] Seq=1 Ack=1 Win=32768 ns3::TcpOptionTS(627;313) ns3::TcpOptionEnd(EOL)) Payload (size=512) Payload Fragment [0:24]
t 0.92656 /NodeList/1/$ns3::Ipv4L3Protocol/Tx(3) ns3::Ipv4Header (tos 0x0 DSCP Default ECN Not-ECT ttl 62 id 2 protocol 6 offset (bytes) 0 flags [none] length: 588 10.1.1.1 > 10.2.2.1) ns3::TcpHeader (49153 > 300 [ACK] Seq=1 Ack=1 Win=32768 ns3::TcpOptionTS(627;313) ns3::TcpOptionEnd(EOL)) Payload (size=512) Payload Fragment [0:24]
r 0.9408 /NodeList/6/$ns3::Ipv4L3Protocol/Rx(1) ns3::Ipv4Header (tos 0x0 DSCP Default ECN Not-ECT ttl 62 id 1 protocol 6 offset (bytes) 0 flags [none] length: 52 10.1.1.1 > 10.2.2.1) ns3::TcpHeader (49153 > 300 [ACK] Seq=1 Ack=1 Win=32768 ns3::TcpOptionTS(627;313) ns3::TcpOptionEnd(EOL))
r 0.94544 /NodeList/7/$ns3::Ipv4L3Protocol/Rx(1) ns3::Ipv4Header (tos 0x0 DSCP Default ECN Not-ECT ttl 62 id 1 protocol 6 offset (bytes) 0 flags [none] length: 52 10.1.2.1 > 10.2.3.1) ns3::TcpHeader (49153 > 300 [ACK] Seq=1 Ack=1 Win=32768 ns3::TcpOptionTS(632;318) ns3::TcpOptionEnd(EOL))
r 0.97376 /NodeList/1/$ns3::Ipv4L3Protocol/Rx(1) ns3::Ipv4Header (tos 0x0 DSCP Default ECN Not-ECT ttl 63 id 2 protocol 6 offset (bytes) 0 flags [none] length: 588 10.1.2.1 > 10.2.3.1) ns3::TcpHeader (49153 > 300 [ACK] Seq=1 Ack=1 Win=32768 ns3::TcpOptionTS(632;318) ns3::TcpOptionEnd(EOL)) Payload (size=512) Payload Fragment [0:24]
t 0.97376 /NodeList/1/$ns3::Ipv4L3Protocol/Tx(4) ns3::Ipv4Header (tos 0x0 DSCP Default ECN Not-ECT ttl 62 id 2 protocol 6 offset (bytes) 0 flags [none] length: 588 10.1.2.1 > 10.2.3.1) ns3::TcpHeader (49153 > 300 [ACK] Seq=1 Ack=1 Win=32768 ns3::TcpOptionTS(632;318) ns3::TcpOptionEnd(EOL)) Payload (size=512) Payload Fragment [0:24]
r 1.07376 /NodeList/6/$ns3::Ipv4L3Protocol/Rx(1) ns3::Ipv4Header (tos 0x0 DSCP Default ECN Not-ECT ttl 62 id 2 protocol 6 offset (bytes) 0 flags [none] length: 588 10.1.1.1 > 10.2.2.1) ns3::TcpHeader (49153 > 300 [ACK] Seq=1 Ack=1 Win=32768 ns3::TcpOptionTS(627;313) ns3::TcpOptionEnd(EOL)) Payload (size=512) Payload Fragment [0:24]
t 1.07376 /NodeList/6/$ns3::Ipv4L3Protocol/Tx(1) ns3::Ipv4Header (tos 0x0 DSCP Default ECN Not-ECT ttl 64 id 1 protocol 6 offset (bytes) 0 flags [none] length: 52 10.2.2.1 > 10.1.1.1) ns3::TcpHeader (300 > 49153 [ACK] Seq=1 Ack=537 Win=32768 ns3::TcpOptionTS(1073;627) ns3::TcpOptionEnd(EOL))
r 1.12096 /NodeList/7/$ns3::Ipv4L3Protocol/Rx(1) ns3::Ipv4Header (tos 0x0 DSCP Default ECN Not-ECT ttl 62 id 2 protocol 6 offset (bytes) 0 flags [none] length: 588 10.1.2.1 > 10.2.3.1) ns3::TcpHeader (49153 > 300 [ACK] Seq=1 Ack=1 Win=32768 ns3::TcpOptionTS(632;318) ns3::TcpOptionEnd(EOL)) Payload (size=512) Payload Fragment [0:24]
t 1.12096 /NodeList/7/$ns3::Ipv4L3Protocol/Tx(1) ns3::Ipv4Header (tos 0x0 DSCP Default ECN Not-ECT ttl 64 id 1 protocol 6 offset (bytes) 0 flags [none] length: 52 10.2.3.1 > 10.1.2.1) ns3::TcpHeader (300 > 49153 [ACK] Seq=1 Ack=537 Win=32768 ns3::TcpOptionTS(1120;632) ns3::TcpOptionEnd(EOL))
r 1.17808 /NodeList/1/$ns3::Ipv4L3Protocol/Rx(3) ns3::Ipv4Header (tos 0x0 DSCP Default ECN Not-ECT ttl 64 id 1 protocol 6 offset (bytes) 0 flags [none] length: 52 10.2.2.1 > 10.1.1.1) ns3::TcpHeader (300 > 49153 [ACK] Seq=1 Ack=537 Win=32768 ns3::TcpOptionTS(1073;627) ns3::TcpOptionEnd(EOL))
t 1.17808 /NodeList/1/$ns3::Ipv4L3Protocol/Tx(1) ns3::Ipv4Header (tos 0x0 DSCP Default ECN Not-ECT ttl 63 id 1 protocol 6 offset (bytes) 0 flags [none] length: 52 10.2.2.1 > 10.1.1.1) ns3::TcpHeader (300 > 49153 [ACK] Seq=1 Ack=537 Win=32768 ns3::TcpOptionTS(1073;627) ns3::TcpOptionEnd(EOL))
r 1.22528 /NodeList/1/$ns3::Ipv4L3Protocol/Rx(4) ns3::Ipv4Header (tos 0x0 DSCP Default ECN Not-ECT ttl 64 id 1 protocol 6 offset (bytes) 0 flags [none] length: 52 10.2.3.1 > 10.1.2.1) ns3::TcpHeader (300 > 49153 [ACK] Seq=1 Ack=537 Win=32768 ns3::TcpOptionTS(1120;632) ns3::TcpOptionEnd(EOL))
t 1.22528 /NodeList/1/$ns3::Ipv4L3Protocol/Tx(1) ns3::Ipv4Header (tos 0x0 DSCP Default ECN Not-ECT ttl 63 id 1 protocol 6 offset (bytes) 0 flags [none] length: 52 10.2.3.1 > 10.1.2.1) ns3::TcpHeader (300 > 49153 [ACK] Seq=1 Ack=537 Win=32768 ns3::TcpOptionTS(1120;632) ns3::TcpOptionEnd(EOL))
r 1.2824 /NodeList/0/$ns3::Ipv4L3Protocol/Rx(1) ns3::Ipv4Header (tos 0x0 DSCP Default ECN Not-ECT ttl 63 id 1 protocol 6 offset (bytes) 0 flags [none] length: 52 10.2.2.1 > 10.1.1.1) ns3::TcpHeader (300 > 49153 [ACK] Seq=1 Ack=537 Win=32768 ns3::TcpOptionTS(1073;627) ns3::TcpOptionEnd(EOL))
t 1.2824 /NodeList/0/$ns3::Ipv4L3Protocol/Tx(2) ns3::Ipv4Header (tos 0x0 DSCP Default ECN Not-ECT ttl 62 id 1 protocol 6 offset (bytes) 0 flags [none] length: 52 10.2.2.1 > 10.1.1.1) ns3::TcpHeader (300 > 49153 [ACK] Seq=1 Ack=537 Win=32768 ns3::TcpOptionTS(1073;627) ns3::TcpOptionEnd(EOL))
r 1.3296 /NodeList/0/$ns3::Ipv4L3Protocol/Rx(1) ns3::Ipv4Header (tos 0x0 DSCP Default ECN Not-ECT ttl 63 id 1 protocol 6 offset (bytes) 0 flags [none] length: 52 10.2.3.1 > 10.1.2.1) ns3::TcpHeader (300 > 49153 [ACK] Seq=1 Ack=537 Win=32768 ns3::TcpOptionTS(1120;632) ns3::TcpOptionEnd(EOL))
t 1.3296 /NodeList/0/$ns3::Ipv4L3Protocol/Tx(3) ns3::Ipv4Header (tos 0x0 DSCP Default ECN Not-ECT ttl 62 id 1 protocol 6 offset (bytes) 0 flags [none] length: 52 10.2.3.1 > 10.1.2.1) ns3::TcpHeader (300 > 49153 [ACK] Seq=1 Ack=537 Win=32768 ns3::TcpOptionTS(1120;632) ns3::TcpOptionEnd(EOL))
r 1.38672 /NodeList/2/$ns3::Ipv4L3Protocol/Rx(1) ns3::Ipv4Header (tos 0x0 DSCP Default ECN Not-ECT ttl 62 id 1 protocol 6 offset (bytes) 0 flags [none] length: 52 10.2.2.1 > 10.1.1.1) ns3::TcpHeader (300 > 49153 [ACK] Seq=1 Ack=537 Win=32768 ns3::TcpOptionTS(1073;627) ns3::TcpOptionEnd(EOL))
t 1.38672 /NodeList/2/$ns3::Ipv4L3Protocol/Tx(1) ns3::Ipv4Header (tos 0x0 DSCP Default ECN Not-ECT ttl 64 id 3 protocol 6 offset (bytes) 0 flags [none] length: 588 10.1.1.1 > 10.2.2.1) ns3::TcpHeader (49153 > 300 [ACK] Seq=537 Ack=1 Win=32768 ns3::TcpOptionTS(1386;1073) ns3::TcpOptionEnd(EOL)) Payload Fragment [24:512] Payload Fragment [0:48]
t 1.38672 /NodeList/2/$ns3::Ipv4L3Protocol/Tx(1) ns3::Ipv4Header (tos 0x0 DSCP Default ECN Not-ECT ttl 64 id 4 protocol 6 offset (bytes) 0 flags [none] length: 588 10.1.1.1 > 10.2.2.1) ns3::TcpHeader (49153 > 300 [ACK] Seq=1073 Ack=1 Win=32768 ns3::TcpOptionTS(1386;1073) ns3::TcpOptionEnd(EOL)) Payload Fragment [48:512] Payload Fragment [0:72]
r 1.43392 /NodeList/3/$ns3::Ipv4L3Protocol/Rx(1) ns3::Ipv4Header (tos 0x0 DSCP Default ECN Not-ECT ttl 62 id 1 protocol 6 offset (bytes) 0 flags [none] length: 52 10.2.3.1 > 10.1.2.1) ns3::TcpHeader (300 > 49153 [ACK] Seq=1 Ack=537 Win=32768 ns3::TcpOptionTS(1120;632) ns3::TcpOptionEnd(EOL))
t 1.43392 /NodeList/3/$ns3::Ipv4L3Protocol/Tx(1) ns3::Ipv4Header (tos 0x0 DSCP Default ECN Not-ECT ttl 64 id 3 protocol 6 offset (bytes) 0 flags [none] length: 588 10.1.2.1 > 10.2.3.1) ns3::TcpHeader (49153 > 300 [ACK] Seq=537 Ack=1 Win=32768 ns3::TcpOptionTS(1433;1120) ns3::TcpOptionEnd(EOL)) Payload Fragment [24:512] Payload Fragment [0:48]
t 1.43392 /NodeList/3/$ns3::Ipv4L3Protocol/Tx(1) ns3::Ipv4Header (tos 0x0 DSCP Default ECN Not-ECT ttl 64 id 4 protocol 6 offset (bytes) 0 flags [none] length: 588 10.1.2.1 > 10.2.3.1) ns3::TcpHeader (49153 > 300 [ACK] Seq=1073 Ack=1 Win=32768 ns3::TcpOptionTS(1433;1120) ns3::TcpOptionEnd(EOL)) Payload Fragment [48:512] Payload Fragment [0:72]
r 1.53392 /NodeList/0/$ns3::Ipv4L3Protocol/Rx(2) ns3::Ipv4Header (tos 0x0 DSCP Default ECN Not-ECT ttl 64 id 3 protocol 6 offset (bytes) 0 flags [none] length: 588 10.1.1.1 > 10.2.2.1) ns3::TcpHeader (49153 > 300 [ACK] Seq=537 Ack=1 Win=32768 ns3::TcpOptionTS(1386;1073) ns3::TcpOptionEnd(EOL)) Payload Fragment [24:512] Payload Fragment [0:48]
t 1.53392 /NodeList/0/$ns3::Ipv4L3Protocol/Tx(1) ns3::Ipv4Header (tos 0x0 DSCP Default ECN Not-ECT ttl 63 id 3 protocol 6 offset (bytes) 0 flags [none] length: 588 10.1.1.1 > 10.2.2.1) ns3::TcpHeader (49153 > 300 [ACK] Seq=537 Ack=1 Win=32768 ns3::TcpOptionTS(1386;1073) ns3::TcpOptionEnd(EOL)) Payload Fragment [24:512] Payload Fragment [0:48]
r 1.58112 /NodeList/0/$ns3::Ipv4L3Protocol/Rx(3) ns3::Ipv4Header (tos 0x0 DSCP Default ECN Not-ECT ttl 64 id 3 protocol 6 offset (bytes) 0 flags [none] length: 588 10.1.2.1 > 10.2.3.1) ns3::TcpHeader (49153 > 300 [ACK] Seq=537 Ack=1 Win=32768 ns3::TcpOptionTS(1433;1120) ns3::TcpOptionEnd(EOL)) Payload Fragment [24:512] Payload Fragment [0:48]
t 1.58112 /NodeList/0/$ns3::Ipv4L3Protocol/Tx(1) ns3::Ipv4Header (tos 0x0 DSCP Default ECN Not-ECT ttl 63 id 3 protocol 6 offset (bytes) 0 flags [none] length: 588 10.1.2.1 > 10.2.3.1) ns3::TcpHeader (49153 > 300 [ACK] Seq=537 Ack=1 Win=32768 ns3::TcpOptionTS(1433;1120) ns3::TcpOptionEnd(EOL)) Payload Fragment [24:512] Payload Fragment [0:48]
r 1.58112 /NodeList/0/$ns3::Ipv4L3Protocol/Rx(2) ns3::Ipv4Header (tos 0x0 DSCP Default ECN Not-ECT ttl 64 id 4 protocol 6 offset (bytes) 0 flags [none] length: 588 10.1.1.1 > 10.2.2.1) ns3::TcpHeader (49153 > 300 [ACK] Seq=1073 Ack=1 Win=32768 ns3::TcpOptionTS(1386;1073) ns3::TcpOptionEnd(EOL)) Payload Fragment [48:512] Payload Fragment [0:72]
t 1.58112 /NodeList/0/$ns3::Ipv4L3Protocol/Tx(1) ns3::Ipv4Header (tos 0x0 DSCP Default ECN Not-ECT ttl 63 id 4 protocol 6 offset (bytes) 0 flags [none] length: 588 10.1.1.1 > 10.2.2.1) ns3::TcpHeader (49153 > 300 [ACK] Seq=1073 Ack=1 Win=32768 ns3::TcpOptionTS(1386;1073) ns3::TcpOptionEnd(EOL)) Payload Fragment [48:512] Payload Fragment [0:72]
r 1.62832 /NodeList/0/$ns3::Ipv4L3Protocol/Rx(3) ns3::Ipv4Header (tos 0x0 DSCP Default ECN Not-ECT ttl 64 id 4 protocol 6 offset (bytes) 0 flags [none] length: 588 10.1.2.1 > 10.2.3.1) ns3::TcpHeader (49153 > 300 [ACK] Seq=1073 Ack=1 Win=32768 ns3::TcpOptionTS(1433;1120) ns3::TcpOptionEnd(EOL)) Payload Fragment [48:512] Payload Fragment [0:72]
t 1.62832 /NodeList/0/$ns3::Ipv4L3Protocol/Tx(1) ns3::Ipv4Header (tos 0x0 DSCP Default ECN Not-ECT ttl 63 id 4 protocol 6 offset (bytes) 0 flags [none] length: 588 10.1.2.1 > 10.2.3.1) ns3::TcpHeader (49153 > 300 [ACK] Seq=1073 Ack=1 Win=32768 ns3::TcpOptionTS(1433;1120) ns3::TcpOptionEnd(EOL)) Payload Fragment [48:512] Payload Fragment [0:72]
r 1.68112 /NodeList/1/$ns3::Ipv4L3Protocol/Rx(1) ns3::Ipv4Header (tos 0x0 DSCP Default ECN Not-ECT ttl 63 id 3 protocol 6 offset (bytes) 0 flags [none] length: 588 10.1.1.1 > 10.2.2.1) ns3::TcpHeader (49153 > 300 [ACK] Seq=537 Ack=1 Win=32768 ns3::TcpOptionTS(1386;1073) ns3::TcpOptionEnd(EOL)) Payload Fragment [24:512] Payload Fragment [0:48]
t 1.68112 /NodeList/1/$ns3::Ipv4L3Protocol/Tx(3) ns3::Ipv4Header (tos 0x0 DSCP Default ECN Not-ECT ttl 62 id 3 protocol 6 offset (bytes) 0 flags [none] length: 588 10.1.1.1 > 10.2.2.1) ns3::TcpHeader (49153 > 300 [ACK] Seq=537 Ack=1 Win=32768 ns3::TcpOptionTS(1386;1073) ns3::TcpOptionEnd(EOL)) Payload Fragment [24:512] Payload Fragment [0:48]
r 1.72832 /NodeList/1/$ns3::Ipv4L3Protocol/Rx(1) ns3::Ipv4Header (tos 0x0 DSCP Default ECN Not-ECT ttl 63 id 3 protocol 6 offset (bytes) 0 flags [none] length: 588 10.1.2.1 > 10.2.3.1) ns3::TcpHeader (49153 > 300 [ACK] Seq=537 Ack=1 Win=32768 ns3::TcpOptionTS(1433;1120) ns3::TcpOptionEnd(EOL)) Payload Fragment [24:512] Payload Fragment [0:48]
t 1.72832 /NodeList/1/$ns3::Ipv4L3Protocol/Tx(4) ns3::Ipv4Header (tos 0x0 DSCP Default ECN Not-ECT ttl 62 id 3 protocol 6 offset (bytes) 0 flags [none] length: 588 10.1.2.1 > 10.2.3.1) ns3::TcpHeader (49153 > 300 [ACK] Seq=537 Ack=1 Win=32768 ns3::TcpOptionTS(1433;1120) ns3::TcpOptionEnd(EOL)) Payload Fragment [24:512] Payload Fragment [0:48]
r 1.77552 /NodeList/1/$ns3::Ipv4L3Protocol/Rx(1) ns3::Ipv4Header (tos 0x0 DSCP Default ECN Not-ECT ttl 63 id 4 protocol 6 offset (bytes) 0 flags [none] length: 588 10.1.1.1 > 10.2.2.1) ns3::TcpHeader (49153 > 300 [ACK] Seq=1073 Ack=1 Win=32768 ns3::TcpOptionTS(1386;1073) ns3::TcpOptionEnd(EOL)) Payload Fragment [48:512] Payload Fragment [0:72]
t 1.77552 /NodeList/1/$ns3::Ipv4L3Protocol/Tx(3) ns3::Ipv4Header (tos 0x0 DSCP Default ECN Not-ECT ttl 62 id 4 protocol 6 offset (bytes) 0 flags [none] length: 588 10.1.1.1 > 10.2.2.1) ns3::TcpHeader (49153 > 300 [ACK] Seq=1073 Ack=1 Win=32768 ns3::TcpOptionTS(1386;1073) ns3::TcpOptionEnd(EOL)) Payload Fragment [48:512] Payload Fragment [0:72]
r 1.82272 /NodeList/1/$ns3::Ipv4L3Protocol/Rx(1) ns3::Ipv4Header (tos 0x0 DSCP Default ECN Not-ECT ttl 63 id 4 protocol 6 offset (bytes) 0 flags [none] length: 588 10.1.2.1 > 10.2.3.1) ns3::TcpHeader (49153 > 300 [ACK] Seq=1073 Ack=1 Win=32768 ns3::TcpOptionTS(1433;1120) ns3::TcpOptionEnd(EOL)) Payload Fragment [48:512] Payload Fragment [0:72]
t 1.82272 /NodeList/1/$ns3::Ipv4L3Protocol/Tx(4) ns3::Ipv4Header (tos 0x0 DSCP Default ECN Not-ECT ttl 62 id 4 protocol 6 offset (bytes) 0 flags [none] length: 588 10.1.2.1 > 10.2.3.1) ns3::TcpHeader (49153 > 300 [ACK] Seq=1073 Ack=1 Win=32768 ns3::TcpOptionTS(1433;1120) ns3::TcpOptionEnd(EOL)) Payload Fragment [48:512] Payload Fragment [0:72]
r 1.82832 /NodeList/6/$ns3::Ipv4L3Protocol/Rx(1) ns3::Ipv4Header (tos 0x0 DSCP Default ECN Not-ECT ttl 62 id 3 protocol 6 offset (bytes) 0 flags [none] length: 588 10.1.1.1 > 10.2.2.1) ns3::TcpHeader (49153 > 300 [ACK] Seq=537 Ack=1 Win=32768 ns3::TcpOptionTS(1386;1073) ns3::TcpOptionEnd(EOL)) Payload Fragment [24:512] Payload Fragment [0:48]
r 1.87552 /NodeList/7/$ns3::Ipv4L3Protocol/Rx(1) ns3::Ipv4Header (tos 0x0 DSCP Default ECN Not-ECT ttl 62 id 3 protocol 6 offset (bytes) 0 flags [none] length: 588 10.1.2.1 > 10.2.3.1) ns3::TcpHeader (49153 > 300 [ACK] Seq=537 Ack=1 Win=32768 ns3::TcpOptionTS(1433;1120) ns3::TcpOptionEnd(EOL)) Payload Fragment [24:512] Payload Fragment [0:48]
r 1.92272 /NodeList/6/$ns3::Ipv4L3Protocol/Rx(1) ns3::Ipv4Header (tos 0x0 DSCP Default ECN Not-ECT ttl 62 id 4 protocol 6 offset (bytes) 0 flags [none] length: 588 10.1.1.1 > 10.2.2.1) ns3::TcpHeader (49153 > 300 [ACK] Seq=1073 Ack=1 Win=32768 ns3::TcpOptionTS(1386;1073) ns3::TcpOptionEnd(EOL)) Payload Fragment [48:512] Payload Fragment [0:72]
t 1.92272 /NodeList/6/$ns3::Ipv4L3Protocol/Tx(1) ns3::Ipv4Header (tos 0x0 DSCP Default ECN Not-ECT ttl 64 id 2 protocol 6 offset (bytes) 0 flags [none] length: 52 10.2.2.1 > 10.1.1.1) ns3::TcpHeader (300 > 49153 [ACK] Seq=1 Ack=1609 Win=32768 ns3::TcpOptionTS(1922;1386) ns3::TcpOptionEnd(EOL))
r 1.96992 /NodeList/7/$ns3::Ipv4L3Protocol/Rx(1) ns3::Ipv4Header (tos 0x0 DSCP Default ECN Not-ECT ttl 62 id 4 protocol 6 offset (bytes) 0 flags [none] length: 588 10.1.2.1 > 10.2.3.1) ns3::TcpHeader (49153 > 300 [ACK] Seq=1073 Ack=1 Win=32768 ns3::TcpOptionTS(1433;1120) ns3::TcpOptionEnd(EOL)) Payload Fragment [48:512] Payload Fragment [0:72]
t 1.96992 /NodeList/7/$ns3::Ipv4L3Protocol/Tx(1) ns3::Ipv4Header (tos 0x0 DSCP Default ECN Not-ECT ttl 64 id 2 protocol 6 offset (bytes) 0 flags [none] length: 52 10.2.3.1 > 10.1.2.1) ns3::TcpHeader (300 > 49153 [ACK] Seq=1 Ack=1609 Win=32768 ns3::TcpOptionTS(1969;1433) ns3::TcpOptionEnd(EOL))
r 2.02704 /NodeList/1/$ns3::Ipv4L3Protocol/Rx(3) ns3::Ipv4Header (tos 0x0 DSCP Default ECN Not-ECT ttl 64 id 2 protocol 6 offset (bytes) 0 flags [none] length: 52 10.2.2.1 > 10.1.1.1) ns3::TcpHeader (300 > 49153 [ACK] Seq=1 Ack=1609 Win=32768 ns3::TcpOptionTS(1922;1386) ns3::TcpOptionEnd(EOL))
t 2.02704 /NodeList/1/$ns3::Ipv4L3Protocol/Tx(1) ns3::Ipv4Header (tos 0x0 DSCP Default ECN Not-ECT ttl 63 id 2 protocol 6 offset (bytes) 0 flags [none] length: 52 10.2.2.1 > 10.1.1.1) ns3::TcpHeader (300 > 49153 [ACK] Seq=1 Ack=1609 Win=32768 ns3::TcpOptionTS(1922;1386) ns3::TcpOptionEnd(EOL))
r 2.07424 /NodeList/1/$ns3::Ipv4L3Protocol/Rx(4) ns3::Ipv4Header (tos 0x0 DSCP Default ECN Not-ECT ttl 64 id 2 protocol 6 offset (bytes) 0 flags [none] length: 52 10.2.3.1 > 10.1.2.1) ns3::TcpHeader (300 > 49153 [ACK] Seq=1 Ack=1609 Win=32768 ns3::TcpOptionTS(1969;1433) ns3::TcpOptionEnd(EOL))
t 2.07424 /NodeList/1/$ns3::Ipv4L3Protocol/Tx(1) ns3::Ipv4Header (tos 0x0 DSCP Default ECN Not-ECT ttl 63 id 2 protocol 6 offset (bytes) 0 flags [none] length: 52 10.2.3.1 > 10.1.2.1) ns3::TcpHeader (300 > 49153 [ACK] Seq=1 Ack=1609 Win=32768 ns3::TcpOptionTS(1969;1433) ns3::TcpOptionEnd(EOL))
r 2.13136 /NodeList/0/$ns3::Ipv4L3Protocol/Rx(1) ns3::Ipv4Header (tos 0x0 DSCP Default ECN Not-ECT ttl 63 id 2 protocol 6 offset (bytes) 0 flags [none] length: 52 10.2.2.1 > 10.1.1.1) ns3::TcpHeader (300 > 49153 [ACK] Seq=1 Ack=1609 Win=32768 ns3::TcpOptionTS(1922;1386) ns3::TcpOptionEnd(EOL))
t 2.13136 /NodeList/0/$ns3::Ipv4L3Protocol/Tx(2) ns3::Ipv4Header (tos 0x0 DSCP Default ECN Not-ECT ttl 62 id 2 protocol 6 offset (bytes) 0 flags [none] length: 52 10.2.2.1 > 10.1.1.1) ns3::TcpHeader (300 > 49153 [ACK] Seq=1 Ack=1609 Win=32768 ns3::TcpOptionTS(1922;1386) ns3::TcpOptionEnd(EOL))
r 2.17856 /NodeList/0/$ns3::Ipv4L3Protocol/Rx(1) ns3::Ipv4Header (tos 0x0 DSCP Default ECN Not-ECT ttl 63 id 2 protocol 6 offset (bytes) 0 flags [none] length: 52 10.2.3.1 > 10.1.2.1) ns3::TcpHeader (300 > 49153 [ACK] Seq=1 Ack=1609 Win=32768 ns3::TcpOptionTS(1969;1433) ns3::TcpOptionEnd(EOL))
t 2.17856 /NodeList/0/$ns3::Ipv4L3Protocol/Tx(3) ns3::Ipv4Header (tos 0x0 DSCP Default ECN Not-ECT ttl 62 id 2 protocol 6 offset (bytes) 0 flags [none] length: 52 10.2.3.1 > 10.1.2.1) ns3::TcpHeader (300 > 49153 [ACK] Seq=1 Ack=1609 Win=32768 ns3::TcpOptionTS(1969;1433) ns3::TcpOptionEnd(EOL))
r 2.23568 /NodeList/2/$ns3::Ipv4L3Protocol/Rx(1) ns3::Ipv4Header (tos 0x0 DSCP Default ECN Not-ECT ttl 62 id 2 protocol 6 offset (bytes) 0 flags [none] length: 52 10.2.2.1 > 10.1.1.1) ns3::TcpHeader (300 > 49153 [ACK] Seq=1 Ack=1609 Win=32768 ns3::TcpOptionTS(1922;1386) ns3::TcpOptionEnd(EOL))
t 2.23568 /NodeList/2/$ns3::Ipv4L3Protocol/Tx(1) ns3::Ipv4Header (tos 0x0 DSCP Default ECN Not-ECT ttl 64 id 5 protocol 6 offset (bytes) 0 flags [none] length: 588 10.1.1.1 > 10.2.2.1) ns3::TcpHeader (49153 > 300 [ACK] Seq=1609 Ack=1 Win=32768 ns3::TcpOptionTS(2235;1922) ns3::TcpOptionEnd(EOL)) Payload Fragment [72:512] Payload Fragment [0:96]
t 2.23568 /NodeList/2/$ns3::Ipv4L3Protocol/Tx(1) ns3::Ipv4Header (tos 0x0 DSCP Default ECN Not-ECT ttl 64 id 6 protocol 6 offset (bytes) 0 flags [none] length: 588 10.1.1.1 > 10.2.2.1) ns3::TcpHeader (49153 > 300 [ACK] Seq=2145 Ack=1 Win=32768 ns3::TcpOptionTS(2235;1922) ns3::TcpOptionEnd(EOL)) Payload Fragment [96:512] Payload Fragment [0:120]
t 2.23568 /NodeList/2/$ns3::Ipv4L3Protocol/Tx(1) ns3::Ipv4Header (tos 0x0 DSCP Default ECN Not-ECT ttl 64 id 7 protocol 6 offset (bytes) 0 flags [none] length: 588 10.1.1.1 > 10.2.2.1) ns3::TcpHeader (49153 > 300 [ACK] Seq=2681 Ack=1 Win=32768 ns3::TcpOptionTS(2235;1922) ns3::TcpOptionEnd(EOL)) Payload Fragment [120:512] Payload Fragment [0:144]
r 2.28288 /NodeList/3/$ns3::Ipv4L3Protocol/Rx(1) ns3::Ipv4Header (tos 0x0 DSCP Default ECN Not-ECT ttl 62 id 2 protocol 6 offset (bytes) 0 flags [none] length: 52 10.2.3.1 > 10.1.2.1) ns3::TcpHeader (300 > 49153 [ACK] Seq=1 Ack=1609 Win=32768 ns3::TcpOptionTS(1969;1433) ns3::TcpOptionEnd(EOL))
t 2.28288 /NodeList/3/$ns3::Ipv4L3Protocol/Tx(1) ns3::Ipv4Header (tos 0x0 DSCP Default ECN Not-ECT ttl 64 id 5 protocol 6 offset (bytes) 0 flags [none] length: 588 10.1.2.1 > 10.2.3.1) ns3::TcpHeader (49153 > 300 [ACK] Seq=1609 Ack=1 Win=32768 ns3::TcpOptionTS(2282;1969) ns3::TcpOptionEnd(EOL)) Payload Fragment [72:512] Payload Fragment [0:96]
t 2.28288 /NodeList/3/$ns3::Ipv4L3Protocol/Tx(1) ns3::Ipv4Header (tos 0x0 DSCP Default ECN Not-ECT ttl 64 id 6 protocol 6 offset (bytes) 0 flags [none] length: 588 10.1.2.1 > 10.2.3.1) ns3::TcpHeader (49153 > 300 [ACK] Seq=2145 Ack=1 Win=32768 ns3::TcpOptionTS(2282;1969) ns3::TcpOptionEnd(EOL)) Payload Fragment [96:512] Payload Fragment [0:120]
t 2.28288 /NodeList/3/$ns3::Ipv4L3Protocol/Tx(1) ns3::Ipv4Header (tos 0x0 DSCP Default ECN Not-ECT ttl 64 id 7 protocol 6 offset (bytes) 0 flags [none] length: 588 10.1.2.1 > 10.2.3.1) ns3::TcpHeader (49153 > 300 [ACK] Seq=2681 Ack=1 Win=32768 ns3::TcpOptionTS(2282;1969) ns3::TcpOptionEnd(EOL)) Payload Fragment [120:512] Payload Fragment [0:144]
r 2.38288 /NodeList/0/$ns3::Ipv4L3Protocol/Rx(2) ns3::Ipv4Header (tos 0x0 DSCP Default ECN Not-ECT ttl 64 id 5 protocol 6 offset (bytes) 0 flags [none] length: 588 10.1.1.1 > 10.2.2.1) ns3::TcpHeader (49153 > 300 [ACK] Seq=1609 Ack=1 Win=32768 ns3::TcpOptionTS(2235;1922) ns3::TcpOptionEnd(EOL)) Payload Fragment [72:512] Payload Fragment [0:96]
t 2.38288 /NodeList/0/$ns3::Ipv4L3Protocol/Tx(1) ns3::Ipv4Header (tos 0x0 DSCP Default ECN Not-ECT ttl 63 id 5 protocol 6 offset (bytes) 0 flags [none] length: 588 10.1.1.1 > 10.2.2.1) ns3::TcpHeader (49153 > 300 [ACK] Seq=1609 Ack=1 Win=32768 ns3::TcpOptionTS(2235;1922) ns3::TcpOptionEnd(EOL)) Payload Fragment [72:512] Payload Fragment [0:96]
r 2.43008 /NodeList/0/$ns3::Ipv4L3Protocol/Rx(3) ns3::Ipv4Header (tos 0x0 DSCP Default ECN Not-ECT ttl 64 id 5 protocol 6 offset (bytes) 0 flags [none] length: 588 10.1.2.1 > 10.2.3.1) ns3::TcpHeader (49153 > 300 [ACK] Seq=1609 Ack=1 Win=32768 ns3::TcpOptionTS(2282;1969) ns3::TcpOptionEnd(EOL)) Payload Fragment [72:512] Payload Fragment [0:96]
t 2.43008 /NodeList/0/$ns3::Ipv4L3Protocol/Tx(1) ns3::Ipv4Header (tos 0x0 DSCP Default ECN Not-ECT ttl 63 id 5 protocol 6 offset (bytes) 0 flags [none] length: 588 10.1.2.1 > 10.2.3.1) ns3::TcpHeader (49153 > 300 [ACK] Seq=1609 Ack=1 Win=32768 ns3::TcpOptionTS(2282;1969) ns3::TcpOptionEnd(EOL)) Payload Fragment [72:512] Payload Fragment [0:96]
r 2.43008 /NodeList/0/$ns3::Ipv4L3Protocol/Rx(2) ns3::Ipv4Header (tos 0x0 DSCP Default ECN Not-ECT ttl 64 id 6 protocol 6 offset (bytes) 0 flags [none] length: 588 10.1.1.1 > 10.2.2.1) ns3::TcpHeader (49153 > 300 [ACK] Seq=2145 Ack=1 Win=32768 ns3::TcpOptionTS(2235;1922) ns3::TcpOptionEnd(EOL)) Payload Fragment [96:512] Payload Fragment [0:120]
t 2.43008 /NodeList/0/$ns3::Ipv4L3Protocol/Tx(1) ns3::Ipv4Header (tos 0x0 DSCP Default ECN Not-ECT ttl 63 id 6 protocol 6 offset (bytes) 0 flags [none] length: 588 10.1.1.1 > 10.2.2.1) ns3::TcpHeader (49153 > 300 [ACK] Seq=2145 Ack=1 Win=32768 ns3::TcpOptionTS(2235;1922) ns3::TcpOptionEnd(EOL)) Payload Fragment [96:512] Payload Fragment [0:120]
r 2.47728 /NodeList/0/$ns3::Ipv4L3Protocol/Rx(3) ns3::Ipv4Header (tos 0x0 DSCP Default ECN Not-ECT ttl 64 id 6 protocol 6 offset (bytes) 0 flags [none] length: 588 10.1.2.1 > 10.2.3.1) ns3::TcpHeader (49153 > 300 [ACK] Seq=2145 Ack=1 Win=32768 ns3::TcpOptionTS(2282;1969) ns3::TcpOptionEnd(EOL)) Payload Fragment [96:512] Payload Fragment [0:120]
t 2.47728 /NodeList/0/$ns3::Ipv4L3Protocol/Tx(1) ns3::Ipv4Header (tos 0x0 DSCP Default ECN Not-ECT ttl 63 id 6 protocol 6 offset (bytes) 0 flags [none] length: 588 10.1.2.1 > 10.2.3.1) ns3::TcpHeader (49153 > 300 [ACK] Seq=2145 Ack=1 Win=32768 ns3::TcpOptionTS(2282;1969) ns3::TcpOptionEnd(EOL)) Payload Fragment [96:512] Payload Fragment [0:120]
r 2.47728 /NodeList/0/$ns3::Ipv4L3Protocol/Rx(2) ns3::Ipv4Header (tos 0x0 DSCP Default ECN Not-ECT ttl 64 id 7 protocol 6 offset (bytes) 0 flags [none] length: 588 10.1.1.1 > 10.2.2.1) ns3::TcpHeader (49153 > 300 [ACK] Seq=2681 Ack=1 Win=32768 ns3::TcpOptionTS(2235;1922) ns3::TcpOptionEnd(EOL)) Payload Fragment [120:512] Payload Fragment [0:144]
t 2.47728 /NodeList/0/$ns3::Ipv4L3Protocol/Tx(1) ns3::Ipv4Header (tos 0x0 DSCP Default ECN Not-ECT ttl 63 id 7 protocol 6 offset (bytes) 0 flags [none] length: 588 10.1.1.1 > 10.2.2.1) ns3::TcpHeader (49153 > 300 [ACK] Seq=2681 Ack=1 Win=32768 ns3::TcpOptionTS(2235;1922) ns3::TcpOptionEnd(EOL)) Payload Fragment [120:512] Payload Fragment [0:144]
r 2.52448 /NodeList/0/$ns3::Ipv4L3Protocol/Rx(3) ns3::Ipv4Header (tos 0x0 DSCP Default ECN Not-ECT ttl 64 id 7 protocol 6 offset (bytes) 0 flags [none] length: 588 10.1.2.1 > 10.2.3.1) ns3::TcpHeader (49153 > 300 [ACK] Seq=2681 Ack=1 Win=32768 ns3::TcpOptionTS(2282;1969) ns3::TcpOptionEnd(EOL)) Payload Fragment [120:512] Payload Fragment [0:144]
t 2.52448 /NodeList/0/$ns3::Ipv4L3Protocol/Tx(1) ns3::Ipv4Header (tos 0x0 DSCP Default ECN Not-ECT ttl 63 id 7 protocol 6 offset (bytes) 0 flags [none] length: 588 10.1.2.1 > 10.2.3.1) ns3::TcpHeader (49153 > 300 [ACK] Seq=2681 Ack=1 Win=32768 ns3::TcpOptionTS(2282;1969) ns3::TcpOptionEnd(EOL)) Payload Fragment [120:512] Payload Fragment [0:144]
r 2.53008 /NodeList/1/$ns3::Ipv4L3Protocol/Rx(1) ns3::Ipv4Header (tos 0x0 DSCP Default ECN Not-ECT ttl 63 id 5 protocol 6 offset (bytes) 0 flags [none] length: 588 10.1.1.1 > 10.2.2.1) ns3::TcpHeader (49153 > 300 [ACK] Seq=1609 Ack=1 Win=32768 ns3::TcpOptionTS(2235;1922) ns3::TcpOptionEnd(EOL)) Payload Fragment [72:512] Payload Fragment [0:96]
t 2.53008 /NodeList/1/$ns3::Ipv4L3Protocol/Tx(3) ns3::Ipv4Header (tos 0x0 DSCP Default ECN Not-ECT ttl 62 id 5 protocol 6 offset (bytes) 0 flags [none] length: 588 10.1.1.1 > 10.2.2.1) ns3::TcpHeader (49153 > 300 [ACK] Seq=1609 Ack=1 Win=32768 ns3::TcpOptionTS(2235;1922) ns3::TcpOptionEnd(EOL)) Payload Fragment [72:512] Payload Fragment [0:96]
r 2.57728 /NodeList/1/$ns3::Ipv4L3Protocol/Rx(1) ns3::Ipv4Header (tos 0x0 DSCP Default ECN Not-ECT ttl 63 id 5 protocol 6 offset (bytes) 0 flags [none] length: 588 10.1.2.1 > 10.2.3.1) ns3::TcpHeader (49153 > 300 [ACK] Seq=1609 Ack=1 Win=32768 ns3::TcpOptionTS(2282;1969) ns3::TcpOptionEnd(EOL)) Payload Fragment [72:512] Payload Fragment [0:96]
t 2.57728 /NodeList/1/$ns3::Ipv4L3Protocol/Tx(4) ns3::Ipv4Header (tos 0x0 DSCP Default ECN Not-ECT ttl 62 id 5 protocol 6 offset (bytes) 0 flags [none] length: 588 10.1.2.1 > 10.2.3.1) ns3::TcpHeader (49153 > 300 [ACK] Seq=1609 Ack=1 Win=32768 ns3::TcpOptionTS(2282;1969) ns3::TcpOptionEnd(EOL)) Payload Fragment [72:512] Payload Fragment [0:96]
r 2.62448 /NodeList/1/$ns3::Ipv4L3Protocol/Rx(1) ns3::Ipv4Header (tos 0x0 DSCP Default ECN Not-ECT ttl 63 id 6 protocol 6 offset (bytes) 0 flags [none] length: 588 10.1.1.1 > 10.2.2.1) ns3::TcpHeader (49153 > 300 [ACK] Seq=2145 Ack=1 Win=32768 ns3::TcpOptionTS(2235;1922) ns3::TcpOptionEnd(EOL)) Payload Fragment [96:512] Payload Fragment [0:120]
t 2.62448 /NodeList/1/$ns3::Ipv4L3Protocol/Tx(3) ns3::Ipv4Header (tos 0x0 DSCP Default ECN Not-ECT ttl 62 id 6 protocol 6 offset (bytes) 0 flags [none] length: 588 10.1.1.1 > 10.2.2.1) ns3::TcpHeader (49153 > 300 [ACK] Seq=2145 Ack=1 Win=32768 ns3::TcpOptionTS(2235;1922) ns3::TcpOptionEnd(EOL)) Payload Fragment [96:512] Payload Fragment [0:120]
